company_name,pt_seafood_database_id,country_hq,main_segment,seg_feed,seg_fishing,seg_aquaculture,seg_processing,seg_wholesale,seg_retail,seg_foodservice,description,website,species_disclosure,revenue_usd_mn,market_cap_usd_mn,ebit_margin,return_on_equity,sustainability_assessment_cat1_transparency_score,sustainability_assessment_cat2_ocean_health_score,sustainability_assessment_cat3_management_governance_score,sustainability_assessment_cat4_fishing_practices_score,sustainability_assessment_cat5_compliance_enforcement_score,sustainability_assessment_cat6_stock_sustainability_score,reporting_precision,n_distinct_countries,n_distinct_species,species_clean,regions,enterprise_value_usd_mn,net_debt_ebitda
SHANGHAI KAICHUANG MARINE INTERNATIONAL CO LTD,ID_221,China,Integrated,FALSE,TRUE,FALSE,TRUE,TRUE,FALSE,FALSE,"Shanghai Kaichuang Marine International Co., Ltd., a subsidiary of Bright Food Group, is a China-based company primarily focused on marine fishing, food processing, and fishery trading. It is also estimated to be the world's largest harvester of tuna.",http://www.skmic.sh.cn,Planet Tracker found species disclosure for part of the seafood portfolio of this company,321.2631861,,3.030109224,2.728890402,1,1,2,1,2,1,0.4090178499320048,4,32,"Alaska Pollack, Alaska Pollock, Albacore Tuna, Anchovy, Antarctic Krill, Cod, Coho Salmon, Crab, Hake, Halibut, Japanese  Mackerel, Japanese Mackerel, Krill, Lingcod, Mackerel, Mussel, Octopodidae, Octopus, Prawn, Rockfish, Sablefish, Salmon, Sardines, Scallops, Skipjack, Skipjack Tuna, Sockeye Salmon, Squid, White Tuna, Yellowfin Tuna",Bering Sea; Chile; Northern Pacific Ocean; Western & Central Pacific Ocean,343.23897852804527,0.00443057395324913
SHINYEI KAISHA,ID_222,Japan,Wholesale/Distribution,FALSE,FALSE,FALSE,TRUE,TRUE,TRUE,TRUE,"Shinyei Kaisha is a diversified Japanese company, founded in 1887, with wholesale and retail operations across four main segments: Foodstuffs (including fresh, frozen, and marine products, and agricultural ventures), General Merchandise, Apparel and Textiles, and Electronics. It is headquartered in Kobe, Japan.",shinyei.co.jp,Planet Tracker found species disclosure for part of the seafood portfolio of this company,265.6073532,24.27833247,4.462242563,26.98736241,1,1,1,1,1,1,0.552266548786906,3,44,"Alaska Pollock, Alfonsino, Anoplopoma Fimbria, Black Cod, Capelin, Clam, Coho Salmon, Cutlassfish, Dolphinfish, Dusky Rockfish, Frost Fish, Golden Flounder, Greenland Halibut, Grenadier, Hake, Herring, Illex Argentinus, Jack Mackerel, Mackerel, Mallotus Villosus, Nile Perch, Octopodidae, Octopus, Oyster, Pacific Cod, Pacific Saury, Pike, Red Fish, Red Snapper, Rockfish, Sagoshi, Saithe, Salmon, Shrimp, Silver Salmon, Silver Warehou, Smelt, Spanish Mackerel, Squid, Striped Atka Mackerel, Trout, Yellow Fin, Yellowtail","China, Vietnam; Japan; Nordic Countries, Russia, New Zealand",127.08588374887573,5.859174964438123
SHOWA SANGYO CO LTD,ID_223,Japan,Feed,TRUE,FALSE,TRUE,TRUE,TRUE,TRUE,FALSE,"Showa Sangyo Co., Ltd. is a Japan-based diversified company operating across multiple segments, including household food products, flour milling, vegetable oil, starches and sweeteners, animal feed, warehousing, and real estate.",showa-sangyo.co.jp,Planet Tracker found full species disclosure for the entire seafood portfolio of this company,2472.397261,,1.249056148,6.673512642,1,1,2,1,1,1,0.7794531416320034,1,5,"Pagrus Major, Paralichthys Olivaceus, Seriola Quinqueradiata, Tetraodontidae",Japan,,3.9461328724737252
SIGMA MARINE TECHNOLOGY,ID_224,Russian Federation,Fishing,FALSE,TRUE,FALSE,FALSE,FALSE,FALSE,FALSE,"Sigma Marine Technology is a Russian company engaged in fishing in the Russian Far East, supplying fresh and frozen fish to processors across Asia, Europe, the US, and Africa.",https://sigma-m-tech.ru,Planet Tracker found species disclosure for part of the seafood portfolio of this company,,,,,2,1,2,2,1,2,0.8347201199030727,4,21,"Alaska Pollock, Anoplopoma Fimbria, Berryteuthis Magister, Brachyura, Clupea Pallasii, Gadus Chalcogrammus, Gadus Macrocephalus, Greenland Halibut, Hippoglossus Stenolepis, Pacific Cod, Pacific Halibut, Pacific Herring, Pacific Mackerel, Pacific Sardine Iwashi, Pleurogrammus Monopterygius, Ray, Reinhardtius Hippoglossoides, Scomber Japonicus, Sebastes Ciliatus, Squid","Khabarovsk; Okhotsk And Bering Seas; Russia, Korea, Japan, China, Hong Kong, Taiwan, Germany, Usa, France, Nigeria, Singapore, Thailand, Netherlands, Turkey, Ghana, Congo, Togo, Egypt, Côte D'ivoire, Denmark, Argentina; Vladivostok",,
SILLA CO LTD,ID_225,Republic of Korea,Fishing,FALSE,TRUE,FALSE,FALSE,FALSE,FALSE,FALSE,"The company operates a diversified business with three core segments: Deep-sea fishery, Steel industry operations, and Restaurant services.",http://www.sla.co.kr,Planet Tracker found full species disclosure for the entire seafood portfolio of this company,363.8914939,36.53249776,1.630165759,6.753603007,1,2,2,2,1,3,0.6561572474133011,8,3,"Katsuwonus Pelamis, Thunnus Albacares, Tuna",Atlantic Ocean; Ghana; Indian Ocean; Kiribati; Nauru; Pacific Ocean; South Korea; Western Central Pacific Ocean,1.671038452370023,-4.801591463094062
SINKABERG-HANSEN AS,ID_226,Norway,Integrated,FALSE,TRUE,TRUE,FALSE,FALSE,FALSE,FALSE,"Sinkaberg-Hansen AS is a breeding company that integrates fisheries, hatcheries, slaughterhouse operations, and processing units.",http://www.sinkaberghansen.no,Planet Tracker found species disclosure for part of the seafood portfolio of this company,,,,,2,2,2,0,1,1,0.584044518851089,5,3,"Atlantic Salmon, Mollusc, Salmon",Bindal; Bronnoy; Heroy; Maroya; Naeroysund,,1.1242956803396253
SIRENA GROUP,ID_227,Denmark,Wholesale/Distribution,FALSE,FALSE,FALSE,FALSE,TRUE,FALSE,FALSE,"Sirena Group is a wholesale distributor of North Atlantic fish and seafood products, recognized as the world's largest exporter of cooked cold-water shrimp.",https://sirenagroup.com/,Planet Tracker found full species disclosure for the entire seafood portfolio of this company,,,,,1,1,1,1,2,2,0.8273664606472757,14,14,"Chionoecetes Opilio, Chlamys Islandica, Clupea Harengus, Gadus Morhua, Homarus Americanus, Mallotus Villosus, Melanogrammus Aeglefinus, Pandalus Borealis, Placopecten Magellanicus, Pleuronectidae, Pollachius Virens, Reinhardtius Hippoglossoides","Barents Sea; Canada; Eastern Canada; Faroe Islands; Greenland; Iceland; Newfoundland, Canada; North Atlantic Ocean; North Atlantic Ocean (Around Iceland); North Atlantic Ocean (Near Faroe Islands And Iceland); North Sea; North Sea (Around Denmark); North-East Atlantic; Norway",,
SKRETTING AS,ID_228,Norway,Feed,TRUE,FALSE,FALSE,FALSE,FALSE,FALSE,FALSE,"Skretting AS, a Norway-based subsidiary of Nutreco N.V., manufactures and supplies specialized fish and shrimp feed for over 60 different aquatic species.",http://www.skretting.com,Planet Tracker found full species disclosure for the entire seafood portfolio of this company,,,,,3,3,3,3,3,3,0.7804426948854093,13,5,"Gadus Morhua, Oncorhynchus Mykiss, Salmo Salar, Salmon, Trout",Australia; Canada; Chile; China; Ecuador; France; Honduras; India; Italy; Norway; Peru; Usa; Vietnam,,0.1792435904805202
SOJITZ,ID_229,Japan,Wholesale/Distribution,FALSE,FALSE,TRUE,TRUE,TRUE,TRUE,TRUE,"Sojitz Corporation is a diversified Japanese trading company involved in multiple sectors, including a substantial seafood business segment encompassing fishing, processing, wholesale, distribution, and retail operations.",sojitz.com,Planet Tracker found species disclosure for part of the seafood portfolio of this company,16698.55128,5464.507575,3.499100672,11.23941887,2,1,2,1,2,2,0.5216474969852726,12,27,"Bluefin Tuna, Canadian Peony Shrimp, Crab, Dried Laver Seaweed, Hokkaido Umami Octopus, Humboldt Squid, Japanese Squid, Mackerel, Octopodidae, Octopus, Puffer Fish, Russian Sweet Shrimp, Salmon, Scallops, Sea Urchin, Shellfish, Shrimp, Shrimps, Squid, Thunnus Thynnus, Trout, Tuna, Wild Oyster, Yellowfin Tuna, Yellowtail","Australia; Canada; Chile; China; Japan; Matsuura City, Nagasaki, Japan; Mexico; Russia; Singapore; Thailand; United Kingdom; Vietnam",11396.3875053685,6.05911596408081
BREMNES SEASHORE,ID_23,Norway,Aquaculture,FALSE,FALSE,TRUE,TRUE,FALSE,FALSE,FALSE,"Bremnes Fryseri is a real estate holding company that owns several firms involved in the salmon industry, including Bremnes Seashore (smolt production, salmon harvesting, and processing), Salmon Brands (SALMA brand sales and marketing), and Sjór (global sales of whole and processed salmon).",http://www.seashore.no,Planet Tracker found full species disclosure for the entire seafood portfolio of this company,,,,,2,2,2,0,2,0,0.6197031547442695,4,2,"Atlantic Salmon, Salmon",Hardanger; Rogaland; Sunnhordland; World,,
SURAPON FOODS,ID_230,Thailand,Processing,FALSE,FALSE,TRUE,TRUE,TRUE,TRUE,TRUE,"The Surapon Foods Public Company Limited group is a frozen food manufacturer, specializing in premium frozen shrimp products and ready-to-cook processed chicken items. They also offer a range of seafood including squid, prawns, pangasius, crab, and eel.",surapon.com,Planet Tracker found species disclosure for part of the seafood portfolio of this company,158.3947267,,5.401679204,7.266483951,1,1,2,1,1,1,0.5784414404241799,1,6,"Crab, Pangasius, Prawn, Shrimp, Squid",Thailand,72.36378308551612,0.29330516279642216
TASSAL GROUP LIMITED,ID_231,Australia,Integrated,FALSE,TRUE,TRUE,TRUE,TRUE,TRUE,FALSE,"Tassal Group Limited is an Australian company specializing in the farming, processing, and marketing of Atlantic salmon, tiger prawns, and various other seafood products.",http://www.tassalgroup.com.au,Planet Tracker found species disclosure for part of the seafood portfolio of this company,560.8106243,617.6282329,7.28927346,6.806337439,3,3,3,0,2,2,0.912950071653976,4,6,"Atlantic Salmon, Lates Calcarifer, Penaeus Monodon, Prawn, Salmo Salar","New South Wales, Australia; Queensland, Australia; Tasmania, Australia; Western Australia, Australia (Cone Bay)",1071.954851291,3.4790815646862567
TECH-BANK FOOD CO LTD (TIANBANG FOOD CO LTD),ID_232,China,Feed,TRUE,FALSE,FALSE,TRUE,TRUE,TRUE,FALSE,"Tech-Bank Food Co., Ltd. is a diversified Chinese agricultural company focusing on the pork and aquatic sectors. Its operations include feed production, pig breeding and farming, pork processing, and the development, manufacturing, and sale of animal vaccines and feed products.",http://www.tianbang.com,Planet Tracker found species disclosure for part of the seafood portfolio of this company,1337.339536,763.8779011,5.498456412,49.50807985,1,0,1,0,0,0,0.6701358900335066,1,9,"Cod, Croaker, Dragon Fish, Hairtail, Macrobrachium Rosenbergii, Prawn, Shrimp, Silver Pomfret",China,1632.9901258260304,4.363921044743778
THAI UNION GROUP PUBLIC COMPANY LIMITED,ID_233,Thailand,Processing,FALSE,FALSE,FALSE,TRUE,FALSE,FALSE,FALSE,Thai Union is a Thailand-based group that specializes in processing and exporting frozen and canned seafood. It is one of the largest producers of processed tuna and shrimp.,http://www.thaiuniongroup.com,Planet Tracker found species disclosure for part of the seafood portfolio of this company,3922.767892,,5.378694478,8.938766599,3,2,3,2,3,3,0.8152777595445616,78,71,"Alaska Pollock, Albacore, Albacore Tuna, American Lobster, Anchoveta, Argentinean Red Shrimp, Atlantic Chub Mackerel, Atlantic Cod, Atlantic Herring, Atlantic Mackerel, Atlantic Salmon, Atlantic Seabob, Basa, Bay Scallop, Bigeye Tuna, Capelin, Caribbean Spiny Lobster, Cephalopod, Chilean Mussel, Cichlidae, Cinnabar Goatfish, Clam, Cod, Common Octopus, Crab, European Pilchard, European Sprat, Finfish, Giant River Prawn, Giant Tiger Prawn, Goatfish Spp, Greasyback Shrimp, Haddock, Herring, Indian Oil Sardine, Jonah Crab, Jumbo Flying Squid, Largehead Hairtail, Lobster, Lumpfish, Mackerel, Mahi-Mahi (Common Dolphinfish), New Zealand Green Mussel, Pacific Chub Mackerel, Pacific Cod, Pacific Saury, Pangasius, Pink Salmon, Rainbow Shrimp, Rainbow Troutsteelhead Trout, Red Squat Lobster, Red Swamp Crawfish, Red Swimming Crab (Warty Swimming Crab), Salmon, Scallop, Shellfish, Shrimp, Skipjack Tuna, Snow Crab (Queen Crab), Sockeye Salmon, Swimming Crab (Multispecies), Swordfish, Tilapia, Tuna, Yellowfin Sole, Yellowfin Tuna",Argentina; Australia; Bahamas; Bangladesh; Brazil; Canada; Cape Verde; Chile; China; Cook Islands; Costa Rica; Denmark; Ecuador; Egypt; El Salvador; Estonia; Faroe Islands; Fiji; Finland; France; Germany; Ghana; Greenland; Guyana; Honduras; Iceland; India; Indonesia; Ireland; Ivory Coast; Jamaica; Japan; Kiribati; Latvia; Malaysia; Maldives; Marshall Islands; Mauritania; Mexico; Micronesia; Morocco; Myanmar; Namibia; Nauru; Netherlands; New Zealand; Nicaragua; Norway; Oman; Pakistan; Palau; Panama; Papua New Guinea; Peru; Philippines; Poland; Portugal; Russia; Senegal; Seychelles; Solomon Islands; South Africa; South Korea; Spain; Sri Lanka; Sweden; Taiwan; Thailand; Tokelau; Tuvalu; United Kingdom; United States; Usa; Vanuatu; Venezuela; Vietnam; World,3508.71894928875,4.646775495802333
THE FISHIN COMPANY,ID_234,United States of America,Wholesale/Distribution,TRUE,FALSE,FALSE,TRUE,FALSE,FALSE,FALSE,"The Fishin Company is a minority-owned seafood importer and distributor based in Munhall, Pennsylvania. It globally sources and sells a range of fresh and frozen seafood, including shrimp, tilapia, cod, salmon, and tuna, along with prepared frozen products like fish sticks and crab cakes.",https://fishincompany.com,Planet Tracker found species disclosure for part of the seafood portfolio of this company,,,4.480052,0.163844,2,2,2,1,2,3,0.6755075386574158,8,23,"Ahi Tuna, Atlantic Salmon, Bay Scallops, Cichlidae, Coho Salmon, Grouper, Keta Salmon, King Crab, King Salmon, Mussel, Oreochromis, Pink Salmon, Salmonidae, Sea Scallops, Shrimp, Snapper, Snow Crab, Sockeye Salmon, Steelhead Trout, Sword Fish, Tilapia",Canada; Chile; China; India; Russia (Far East); United Kingdom; Us; Usa,,0.3752670391452995
THUAN PHUOC FISHERIES AND TRADING JOINT STOCK COMPANY,ID_235,Viet Nam,Processing,FALSE,FALSE,TRUE,TRUE,TRUE,TRUE,TRUE,Thuan Phuoc Fisheries and Trading Joint Stock Company is a Vietnamese producer and exporter of frozen seafood products.,http://www.thuanphuoc.vn,Planet Tracker found full species disclosure for the entire seafood portfolio of this company,,,,,1,1,2,1,2,1,0.823505312672602,7,3,"Amadai, Nobashi Shrimp, Vannamei Shrimp","Ben Tre, Vietnam; Da Nang, Vietnam; Hue, Vietnam; Phu Yen, Vietnam; Quang Nam, Vietnam; Quang Tri, Vietnam; Soc Trang, Vietnam",,
TIANJIN CHIA TAI,ID_236,China,Feed,TRUE,FALSE,FALSE,FALSE,FALSE,TRUE,FALSE,"Tianjin Chia Tai, a wholly-owned subsidiary of the Thai multinational Charoen Pokphand Group (Chia Tai Group), is a major domestic producer of compound premix feed, located in the Tianjin Binhai New Area.",http://www.cppremix.cn,Planet Tracker did not find sufficient species disclosure for the seafood portfolio of this company,,,,,2,3,3,0,2,3,,1,0,,China,,
TOHTO SUISAN CO LTD,ID_237,Japan,Wholesale/Distribution,FALSE,FALSE,FALSE,TRUE,TRUE,FALSE,FALSE,"Tohto Suisan is a Japanese company specializing in cold storage and wholesaling of marine products, with additional interests in real estate leasing. Its international operations, including fish manufacturing and processing, are managed by its Canadian subsidiary, ATC (Aero Trading Co., Ltd.).",http://www.tohsui.co.jp,Planet Tracker found full species disclosure for the entire seafood portfolio of this company,692.3734413,28.45105913,2.819602679,9.897366537,1,1,2,1,1,2,0.7935177376719439,3,5,"Istiophoridae, Oncorhynchus, Thunnus Albacares, Thunnus Obesus, Thunnus Thynnus","Hokkaido, Japan; Kushiro, Japan; Tokyo, Japan",137.03500179252183,-1.4022589052997394
TOKYO ICHIBAN FOODS,ID_238,Japan,Integrated,FALSE,TRUE,TRUE,TRUE,TRUE,TRUE,TRUE,"Tokyo Ichiban Foods is a Japanese integrated seafood company involved in farming, processing, and distribution. It also operates restaurants (including Sakana-no-mama and Fuguyoshi Souhonten) and retail outlets.",https://www.tokyo-ichiban-foods.co.jp,Planet Tracker found species disclosure for part of the seafood portfolio of this company,49.23269201,16.07685585,2.99787847,2.482487147,1,1,1,0,1,1,0.6613273449230721,7,7,"Blowfish, Salmon, Squid, Takifugu Rubripes, Thunnus Orientalis, Tuna, Yellowtail","Hirado, Nagasaki, Japan; Koto-Ku, Tokyo, Japan; Nagasaki; New York, Usa; Saiki, Oita, Japan; Tokyo; Tokyo Metropolitan Area, Japan",35.65807246478972,2.656630075564596
TOYO SUISAN KAISHA LIMITED,ID_239,Japan,Integrated,FALSE,FALSE,TRUE,TRUE,TRUE,TRUE,FALSE,"Toyo Suisan Kaisha Limited, or Toyo Suisan, is a Japanese food company specializing in a diverse range of processed products, including ramen noodles (Maruchan brand), seafood, and other frozen and refrigerated foods.",https://www.maruchan.co.jp,Planet Tracker found species disclosure for part of the seafood portfolio of this company,3381.778742,4875.710186,13.60659124,12.82569668,2,2,2,1,2,2,0.18026106068699363,2,20,"Carangidae, Clupeidae, Fish, Gadidae, Nephropidae, Osmeridae, Salmon, Salmonidae, Scomberesocidae, Scombridae, Shellfish, Shrimp, Trout, Unagi Eel",Japan; Usa,4815.00759853314,-2.8688233362451165
BRIGHT FOOD GROUP,ID_24,China,Processing,FALSE,FALSE,FALSE,TRUE,TRUE,TRUE,FALSE,"Bright Food (Group) Co Ltd. is a Chinese food and beverage manufacturer and distributor with operations spanning agriculture, food service, processing, production, and distribution. Its seafood interests are primarily handled by its subsidiary, Shanghai Kaichuang Marine International.",https://www.brightfood.com,Planet Tracker found full species disclosure for the entire seafood portfolio of this company,,,,,1,1,1,1,2,1,0.7129751047547173,5,6,"Peony Shrimp, Red Shrimp, Scombridae, Sockeye (Salmon), Tuna",Argentina; China; Kiribati; Marshall Islands; Spain,,
TONGWEI FOOD,ID_240,China,Feed,FALSE,FALSE,TRUE,TRUE,FALSE,TRUE,TRUE,"Tongwei is a China-based conglomerate focused on the research, development, production, and sale of aquatic products, livestock, and poultry products, operating through multiple subsidiaries.",http://www.tongweifood.cn,Planet Tracker found species disclosure for part of the seafood portfolio of this company,12719.98096,6821.872858,-7.246901861,-12.79952006,1,1,2,0,1,1,0.4194763269709031,1,18,"Acipenseridae, Cichlidae, Fish, Mandarin Fish, Mullet, Murray Cod, Salmonidae, Sciaenidae, Sea Bass, Shellfish, Shrimp, Squid, Tilapia",China,24855.04368595187,26.78103892386569
TRIDENT SEAFOODS,ID_241,United States of America,Integrated,FALSE,TRUE,FALSE,TRUE,TRUE,FALSE,FALSE,"Trident Seafoods is North America's largest vertically integrated seafood company, headquartered in Seattle, Washington, primarily focused on commercial fishing and initial processing operations in Alaska.",tridentseafoods.com,Planet Tracker found species disclosure for part of the seafood portfolio of this company,,,12.891451,0.291696,2,2,2,2,3,3,0.7427727613476413,19,24,"Alaskan Snow Crab, Alaskan Sockeye Salmon, Chilean Seabass, Cichlidae, Coho Salmon, Flounder/Sole, Gadus Chalcogrammus, Gadus Macrocephalus, Haddock, Halibut, Keta Salmon, King Crab, Oncorhynchus, Pacific (Alaskan) Cod, Pacific Rockfish, Pink Salmon, Shellfish, Shrimp, Steelhead, Swordfish, Tilapia, Wild Alaska Pollock","Alaska; Alaska Peninsula And Aleutian Islands (Area M), Usa; Brazil; China; El Salvador; False Pass, Alaska, Usa (Plant Sold To Silver Bay Seafoods); France; Georgia; Germany; Japan; Kodiak, Alaska, Usa (Plant Sold To Pacific Seafood In Late 2024); Mexico; Minnesota; Netherlands; Saint Paul, Alaska, Usa (Plant Closed Through 2025); Southeast Alaska, Usa; Unalaska, Alaska, Usa (New Plant Construction Delayed); Washington",,0.747861489206809
TRIPLENINE GROUP AS,ID_242,Denmark,Integrated,TRUE,TRUE,FALSE,TRUE,FALSE,FALSE,FALSE,Triple Nine Group specializes in the manufacturing and sale of fish meal and fish oil.,http://www.999.dk,Planet Tracker found species disclosure for part of the seafood portfolio of this company,,,,,1,2,2,1,1,3,0.5399974867663737,7,9,"Ammodytes Marinus, Clupea Harengus, Fish, Platichthys Flesus, Scomber Scombrus, Sprattus Sprattus, Trachinus Draco","Denmark; Fao 27, Ices 3.A, 4 (Skagerrak, Kattegat, And North Sea); Fao Area 27, Ices Divisions 4a-C; North Sea, Skagerrak And Kattegat (Ices In Subarea 4 And Division 3.A); North Sea, Skagerrak And Kattegat, Eastern English Channel (Subarea 4 And 7.D); Northeast Atlantic And Adjacent Waters (Ices Subareas 18 And 14, And In Division 9.A); Skagerrak, Kattegat, Sound, Belt Sea, And Baltic Sea (Subarea Iii) And North Sea (Subarea Iv)",,0.0
TSP LIVESTOCK AND DEVELOPMENT CORP,ID_243,Philippines,Feed,FALSE,TRUE,FALSE,TRUE,TRUE,TRUE,TRUE,"TSP Marine Industries, a subsidiary of TSP Livestock and Development Corporation, is a fully integrated tuna company involved in fishing, processing, wholesale/distribution, retail, and foodservice.",https://tspmi.com.ph,Planet Tracker found full species disclosure for the entire seafood portfolio of this company,,,,,1,1,1,1,1,1,0.1180706003499601,6,3,"Scombridae, Tuna",Europe; Japan; Papua New Guinea; Philippines; Thailand; Vietnam,,
TSUKIJI UOICHIBA COMPANY LIMITED,ID_244,Japan,Wholesale/Distribution,FALSE,FALSE,FALSE,TRUE,TRUE,FALSE,FALSE,"Tsukiji Uoichiba Company Limited specializes in marine products, with operations including seafood processing and wholesale, refrigerated warehousing, and real estate.",http://www.tsukiji-uoichiba.co.jp,Planet Tracker found species disclosure for part of the seafood portfolio of this company,387.8076122,26.36550237,0.061327746,3.238866397,1,1,2,0,1,1,0.6721207315490276,2,18,"Katsuwonus Pelamis, Ostreidae, Pagrus Major, Paralichthys Olivaceus, Ruditapes Philippinarum, Salmonidae, Sardinops, Scomber, Seriola, Shellfish, Takifugu, Thunnus, Thunnus Maccoyii, Thunnus Obesus, Trachurus Japonicus","Japan; Tokyo, Japan",71.97110998914945,7.7556109725685785
UOKI,ID_245,Japan,Wholesale/Distribution,FALSE,TRUE,TRUE,TRUE,TRUE,TRUE,TRUE,"Uoki is a Japanese food company specializing in the retail sale of fresh seafood, sushi, and prepared foods, and also operates conveyor belt sushi restaurants. The company is based in Fujisawa, Kanagawa, Japan.",uoki.co.jp,Planet Tracker found species disclosure for part of the seafood portfolio of this company,65.11079789,9.803068645,0.734000434,5.001621083,1,1,1,1,1,1,0.46920706161246123,1,15,"Anguilla Japonica, Crab, Doederleinia Berycoides, Mackerel, Octopodidae, Octopus, Oncorhynchus, Oyesters, Salmon, Scallops, Scomber Japonicus, Shrimp, Squid, Thunnus, Tuna",Japan,16.15546466094555,-2.4625273129309555
UORIKI,ID_246,Japan,Retail,FALSE,TRUE,FALSE,TRUE,TRUE,TRUE,TRUE,"Uoriki is a Japan-based company specializing in the retail of fresh fish and sushi, wholesale distribution of fishery products, and operating in the food and beverage sector.",https://www.uoriki-seafoods.com,Planet Tracker found full species disclosure for the entire seafood portfolio of this company,240.111974,107.9722264,4.355171663,8.115544731,1,1,2,1,1,1,1.0,4,8,"Brama Japonica, Corbicula Japonica, Evistias Acutirostris, Lateolabrax Japonicus, Oncorhynchus Kisutch, Plecoglossus Altivelis, Thunnus Thynnus, Trachurus Japonicus",Hong Kong; Japan; Thailand; Usa,165.85659914060116,-5.010653641201942
VICIUNAI UAB,ID_247,Lithuania,Wholesale/Distribution,FALSE,FALSE,FALSE,TRUE,TRUE,FALSE,FALSE,"Viciunai UAB is a Lithuanian company, established in 1991, specializing in the international transportation of temperature-controlled food products.",http://www.rido.lt,Planet Tracker found species disclosure for part of the seafood portfolio of this company,,,,,2,2,2,0,2,3,0.3960321255201401,4,9,"Finfish, Gadus Chalcogrammus, Macruronus Novaezelandiae, Merluccius Productus, Oyster, Salmonidae, Shellfish, Shrimp","Europe, Asia, Usa; Lithuania; Lithuania, Estonia; Lithuania, Estonia, Spain",,
VINH HOAN CORP,ID_248,Viet Nam,Integrated,FALSE,TRUE,TRUE,TRUE,FALSE,FALSE,FALSE,"Vinh Hoan Corporation is a Vietnam-based, vertically integrated seafood company specializing in the cultivation, processing, and export of fresh, frozen, and value-added Pangasius products.",http://vinhhoan.com,Planet Tracker found full species disclosure for the entire seafood portfolio of this company,517.8089219,330.8651505,9.915953471,14.40659296,2,2,3,0,1,3,0.8686942787885735,4,3,"Pangasius, Pangasius Hypophthalmus",China; Europe; United States; Vietnam,640.6225328338169,-0.372894525076571
WOOSUNG FEED CO LTD,ID_249,Republic of Korea,Feed,TRUE,FALSE,FALSE,FALSE,FALSE,FALSE,FALSE,"Woosung Feed Co.,Ltd. manufactures, supplies, and distributes various feed products for the livestock and aquaculture industries.",http://www.woosungfeed.co.kr,Planet Tracker found full species disclosure for the entire seafood portfolio of this company,444.6309179,13.8924173,1.417367899,10.29087374,1,1,1,0,1,1,0.4425957523519628,2,12,"Channidae, Cichlidae, Cyprinidae, Pangasiidae, Penaeus Monodon, Ranidae, Salmonidae",Korea; Vietnam,101.91784828605482,4.926489180842987
BRIM HF,ID_25,Iceland,Fishing,FALSE,TRUE,FALSE,TRUE,FALSE,FALSE,FALSE,Brim is a company involved in the fishing and processing of ground fish and pelagic fish.,http://www.hbgrandi.is,Planet Tracker found species disclosure for part of the seafood portfolio of this company,421.2123184,456.432186,11.77327187,8.557520557,2,3,3,2,2,3,0.5786614823115498,2,9,"Blue Whiting, Cod, Greenland Halibut, Haddock, Herring, Mackerel, Redfish, Saithe, Silver Smelt",Iceland; North Atlantic,1397.2984024840162,5.159071460002642
