company_name,pt_seafood_database_id,country_hq,main_segment,seg_feed,seg_fishing,seg_aquaculture,seg_processing,seg_wholesale,seg_retail,seg_foodservice,description,website,species_disclosure,revenue_usd_mn,market_cap_usd_mn,ebit_margin,return_on_equity,sustainability_assessment_cat1_transparency_score,sustainability_assessment_cat2_ocean_health_score,sustainability_assessment_cat3_management_governance_score,sustainability_assessment_cat4_fishing_practices_score,sustainability_assessment_cat5_compliance_enforcement_score,sustainability_assessment_cat6_stock_sustainability_score,reporting_precision,n_distinct_countries,n_distinct_species,species_clean,regions,enterprise_value_usd_mn,net_debt_ebitda
GRUPOMAR,ID_285,Mexico,Integrated,TRUE,TRUE,FALSE,TRUE,TRUE,TRUE,FALSE,"Grupomar (Grupo Marítimo Industrial S.A. de C.V.) is a vertically integrated Mexican tuna group that owns yellowfin fleets and a large canning and freezing complex in Manzanillo, Colima, supplying brands like Tuny, Ancla, Capitán Nemo and Martuna. ",www.grupomar.com,Planet Tracker found full species disclosure for the entire seafood portfolio of this company,,,,,1,2,3,2,2,3,0.7569126435725592,4,1,Thunnus Albacares,"Atlantic Ocean (Historical, Formerly Based In Dakar, Senegal); Eastern Pacific Ocean (From Mexico To Ecuador, West To Hawaii); Manzanillo, Colima, Mexico; Mexico, Central America",,
INEPACA,ID_286,Ecuador,Processing,FALSE,FALSE,FALSE,TRUE,FALSE,FALSE,FALSE,Industria Ecuatoriana Productora de Alimentos (Inepaca) is an Ecuador-based company that processes tuna and sardines.,no website,Planet Tracker found full species disclosure for the entire seafood portfolio of this company,,,,,2,2,3,2,2,3,0.5289253255422736,2,4,"Clupeidae, Thunnus Albacares, Thunnus Obesus","Eastern Pacific Ocean; Manta, Ecuador",,
MARS INC,ID_287,United States of America,Integrated,FALSE,FALSE,FALSE,TRUE,TRUE,TRUE,FALSE,"Mars, Incorporated is a large American multinational that manufactures confectionery, pet food, and other food products and also provides veterinary and animal care services",www.mars.com,Planet Tracker found full species disclosure for the entire seafood portfolio of this company,,,12.21076,0.453549,2,3,3,1,2,3,0.1291007358615744,1,2,Scombridae,Thailand,,0.9298988941870934
NEGOCIOS INDUSTRIALES REAL NIRSA SA,ID_288,Ecuador,Integrated,FALSE,TRUE,TRUE,TRUE,TRUE,FALSE,FALSE,NIRSA is one of Ecuador’s largest tuna and shrimp producers and exporters.,https://nirsa.com/,Planet Tracker found species disclosure for part of the seafood portfolio of this company,,,,,2,2,2,2,2,2,0.4314637875882517,3,4,"Katsuwonus Pelamis, Shellfish, Thunnus Albacares","Eastern Pacific Ocean; Ecuador; Global (North America, South America, European Union, Asia)",,
PINGTAIRONG OCEAN FISHERIES,ID_289,China,Integrated,FALSE,TRUE,FALSE,TRUE,TRUE,TRUE,FALSE,Chinese distant‑water fishing company Pingtairong Ocean Fisheries operates large high‑seas vessels targeting species such as squid and tuna/,www.ptrcn.com,Planet Tracker found full species disclosure for the entire seafood portfolio of this company,,,,,1,2,2,2,1,3,1.0,2,3,"Thunnus Alalunga, Thunnus Albacares, Thunnus Obesus",China; Pacific Ocean,,
CENTURY PACIFIC FOOD INC,ID_29,Philippines,Processing,FALSE,FALSE,FALSE,TRUE,TRUE,TRUE,FALSE,"Century Pacific Food Inc. is a leading branded food company in the Philippines that manages the entire process (from purchasing and processing to canning, packaging, and manufacturing) for a broad spectrum of products, including fish, seafood, meat, produce, and agricultural items.",https://centurypacific.com.ph,Planet Tracker found full species disclosure for the entire seafood portfolio of this company,1317.700244,893.1688575,9.969662238,18.46015884,2,2,3,1,2,3,0.7129751047547173,1,2,"Sardines, Tuna",Philippines,2632.112656589842,0.21559913610899062
PINGTAN MARINE ENTERPRISE,ID_290,China,Integrated,FALSE,TRUE,FALSE,TRUE,TRUE,TRUE,FALSE,"Pingtan Marine Enterprise Ltd. is a China-based deep-sea fishing company operating fleets in international waters, including the Indian EEZ, Indo-Pacific waters, and the Arafura Sea. The company supplies frozen seafood, primarily ribbon fish, croaker, squid, and shrimp, to distributors, restaurants, and exporters.",no website,Planet Tracker found full species disclosure for the entire seafood portfolio of this company,,,,,1,1,1,1,1,1,0.7088385453211471,4,6,"Dosidicus Gigas, Illex Argentinus, Sardina, Sthenoteuthis Oualaniensis",Ecuador (Galapagos Marine Reserve); India (Bay Of Bengal); International Waters; Prc,,
QINGDAO OCEAN FISHERY,ID_291,China,Fishing,FALSE,TRUE,FALSE,TRUE,TRUE,FALSE,FALSE,"Qingdao Ocean Fishery Co., Ltd. is a Chinese distant-water fishing company, part of Shandong Xinfa Holding Co., Ltd. Established in 2012, it specializes in ocean fishing, operating a fleet of large double-deck trawlers and tuna longline vessels for long-duration offshore operations, and is also developing its sales and overseas base network.",en.qofgroup.com,Planet Tracker found species disclosure for part of the seafood portfolio of this company,,,,,1,1,1,1,1,1,0.027349588662354686,3,2,Shellfish,"Atlantic Ocean, Pacific Ocean, Indian Ocean; Qingdao, China; Southwest Atlantic Ocean",,
CHISHAN GROUP,ID_292,China,Integrated,FALSE,TRUE,FALSE,TRUE,TRUE,FALSE,FALSE,"Chishan Group is a Chinese seafood company specializing in the processing and international export of frozen seafood, including squid and various fish. It is vertically integrated, managing the supply chain from raw material sourcing to delivery.",http://www.sdchishan.com/index.html,Planet Tracker found full species disclosure for the entire seafood portfolio of this company,,,,,1,1,1,1,1,1,0.36213643837647713,5,1,Illex,"China (Rongcheng, Shandong); Indian Ocean; North Pacific Ocean; Pacific Ocean (Peruvian Waters); Southwest Atlantic Ocean (Argentine Waters)",,
RONGCHENG OCEAN FISHERIES,ID_293,China,Fishing,FALSE,TRUE,FALSE,TRUE,TRUE,FALSE,FALSE,"Rongcheng Ocean Fisheries Co., Ltd. is a large Chinese distant‑water tuna longline company based in Rongcheng, Shandong. It controls multiple longline vessels fishing for tuna across the Western and Central Pacific and other high‑seas areas.",no website,Planet Tracker did not find sufficient species disclosure for the seafood portfolio of this company,,,,,1,1,1,1,1,1,,3,0,,China; Southeast Pacific Ocean; Southwest Atlantic Ocean,,
RONGCHENG RONGYUAN FISHERIES,ID_294,China,Fishing,FALSE,TRUE,FALSE,TRUE,TRUE,FALSE,FALSE,"Rongcheng Rongyuan Fisheries Co., Ltd. is a large privately owned Chinese distant‑water fishing company based in Rongcheng, Shandong.  It is one of China’s top distant‑water operators and targets squid and tuna on the high seas using gear such as squid jiggers and tuna longlines.",no website,Planet Tracker did not find sufficient species disclosure for the seafood portfolio of this company,,,,,1,1,1,1,1,1,,0,0,,,,
RONGCHENG YONGJIN AQUATIC,ID_295,China,Fishing,FALSE,TRUE,FALSE,TRUE,FALSE,FALSE,FALSE,"Rongcheng Yongjin Aquatic Co., Ltd. ranks as one of the top 20 largest Chinese distant‑water fishing and exporting companies.",http://www.sd-yongjin.com/,Planet Tracker found species disclosure for part of the seafood portfolio of this company,,,,,1,1,1,1,1,1,0.031284980421921314,4,2,Shellfish,"China; Southeast Pacific Ocean; Southeast Pacific Ocean, Southwest Atlantic Ocean; Southwest Atlantic Ocean",,
SHANDONG MARINE GROUP,ID_296,China,Integrated,FALSE,TRUE,TRUE,TRUE,FALSE,FALSE,FALSE,"Shandong Marine Group is a large Chinese state‑linked distant‑water fishing conglomerate (via Shandong Zhonglu Oceanic Fisheries) operating tuna longliners, purse‑seiners, trawlers and squid vessels with integrated cold‑storage, transport and processing",https://en.sdmg.cn/,Planet Tracker found full species disclosure for the entire seafood portfolio of this company,,,,,1,2,2,1,1,1,0.6273106287956549,2,4,"Oplegnathus Punctatus, Plectropomus Leopardus, Pseudocaranx Dentex, Thunnus","Atlantic Ocean; Shandong, China",,
SHENZHEN LIANCHENG OVERSEAS FISHERIES,ID_297,China,Fishing,FALSE,TRUE,FALSE,TRUE,FALSE,FALSE,FALSE,"Shenzhen Liancheng Overseas Fisheries Co., Ltd. is a privately owned Chinese distant‑water fishing company based in Shenzhen, Guangdong.",http://www.iszlc.com/,Planet Tracker found full species disclosure for the entire seafood portfolio of this company,,,,,2,3,2,2,2,3,1.0,9,3,"Thunnus Alalunga, Thunnus Albacares, Thunnus Obesus","China; Cook Islands; Federated States Of Micronesia; Japan; Pacific Ocean; Palau; Republic Of The Marshall Islands; Saipan, United States; United States",,
ZHEJIANG ZHOUPU OCEAN FISHERIES,ID_298,China,Fishing,FALSE,TRUE,FALSE,TRUE,TRUE,FALSE,FALSE,"Zhejiang Zhoupu Ocean Fisheries Co., Ltd. is a privately owned Chinese distant‑water squid fishing company based in Zhejiang Province. The firm owns multiple industrial squid‑jigging vessels active on the high seas.",no website,Planet Tracker found full species disclosure for the entire seafood portfolio of this company,,,,,1,1,1,1,1,1,0.8211226055425584,3,3,"Dosidicus Gigas, Illex Argentinus",Argentina; Pacific; Peru,,
ZHOUSHAN HUAYING OCEAN FISHERIES,ID_299,China,Fishing,FALSE,TRUE,FALSE,TRUE,FALSE,FALSE,FALSE,"Zhoushan Huaying Ocean Fisheries Co., Ltd. is a privately owned Chinese distant‑water fishing company based in Zhoushan, Zhejiang, operating around six large industrial vessels in the global squid fleet and ranking among China’s top 30 distant‑water operators by revenue. ",no website,Planet Tracker found full species disclosure for the entire seafood portfolio of this company,,,,,1,1,2,1,2,1,0.11785160160133591,2,2,Ommastrephidae,North Pacific Ocean; Southeast Pacific Ocean,,
AKER BIOMARINE AS,ID_3,Norway,Integrated,TRUE,TRUE,TRUE,TRUE,TRUE,FALSE,FALSE,"Aker BioMarine is a biotechnology and krill harvesting company with two segments: Ingredients (developing krill-based ingredients for nutraceuticals, dietary supplements, aquaculture, and pet food) and Brands (including Lang Pharma Nutrition for private label supplements and Epion Brands, which markets the Kori consumer brand in the US).",http://www.akerbiomarine.com,Planet Tracker did not find sufficient species disclosure for the seafood portfolio of this company,199.1268873,26.51631053,0.201004234,-5.328007393,3,2,3,3,3,3,0.07785242449660769,1,1,Krill,"Area 48, Antarctica",679.8717578373014,8.135645059507805
CERMAQ,ID_30,Norway,Aquaculture,FALSE,FALSE,TRUE,FALSE,FALSE,FALSE,FALSE,"Cermaq is a global salmon producer, headquartered in Norway, specializing in the production of Atlantic and Coho salmon with operations in Norway, Canada, and Chile.",https://www.cermaq.com,Planet Tracker found full species disclosure for the entire seafood portfolio of this company,,,,,3,2,3,0,2,3,1.0,3,3,"Atlantic Salmon, Coho Salmon, Salmo Salar",Canada; Chile; Norway,,0.0
ZHOUSHAN JIADE INTERNATIONAL FISHERIES,ID_300,China,Fishing,FALSE,TRUE,FALSE,TRUE,TRUE,FALSE,FALSE,"Zhoushan Jiade International Fisheries Co., Ltd. is a privately owned Chinese distant‑water fishing company based in Dinghai, Zhoushan, Zhejiang, operating around seven large industrial vessels",no website,Planet Tracker found species disclosure for part of the seafood portfolio of this company,,,,,1,1,1,1,1,1,0.040963398296528085,1,2,Shellfish,Southwest Atlantic Ocean (High Seas Near Argentina),,
CHAROEN POKPHAND FOODS,ID_31,Thailand,Aquaculture,TRUE,FALSE,TRUE,TRUE,TRUE,TRUE,TRUE,"CPF is an agro-industrial and food conglomerate with three main divisions: Feed, Farm (raising swine, poultry, shrimp, and fish), and Food. It is involved in livestock and aquaculture and also operates retail and food outlets.",https://www.cpfworldwide.com,Planet Tracker found species disclosure for part of the seafood portfolio of this company,16456.59413,,5.959347374,8.27512801,2,2,3,1,2,2,0.7461440135047658,7,9,"Catfish, Cichlidae, Macrobrachium Rosenbergii, Oreochromis Niloticus, Penaeus Monodon, Shrimp, Tilapia",China; India; Malaysia; Philippines; Thailand; Usa; Vietnam,21086.925003666198,7.472462823389392
CHINA NATIONAL FISHERIES CORPORATION,ID_32,China,Fishing,FALSE,TRUE,FALSE,TRUE,TRUE,FALSE,FALSE,"CNFC National Fisheries, a subsidiary of China National Fisheries Corporation (CNFC), is one of China's largest fisheries companies, managing a fleet of over 200 fishing vessels and operating globally in more than 20 countries.",https://cnfc.cnadc.com.cn,Planet Tracker found species disclosure for part of the seafood portfolio of this company,,,,,1,1,2,1,1,1,0.19683351679274544,10,9,"Crab, Euphausia Superba, Lobster, Scombridae, Shellfish, Squid, Tuna","Antarctic Ocean; Antartic Waters; Atlantic Ocean; Global (Europe, Africa, United States, Japan, South Korea, Middle East, China); Indian Ocean; Japan Sea; North Pacific Ocean; Pacific Ocean; South Pacific Ocean; Vanuatu",,
CHOKYUMARU SUISAN,ID_33,Japan,Fishing,FALSE,TRUE,FALSE,TRUE,TRUE,FALSE,FALSE,"Chokyumaru Suisan is a Japanese company focused on tuna fishing, processing, and distribution.",,Planet Tracker found species disclosure for part of the seafood portfolio of this company,,,,,1,1,1,2,1,1,0.596955484102458,5,16,"Albacore Tuna, Bigeye Tuna, Bluefin Tuna, Bonito, Katsuwonus Pelamis, Pectinidae, Salmon, Scallop, Sea Urchin, Shellfish, Shrimp, Thunnus Alalunga, Thunnus Thynnus, Yellowfin Tuna","Coastal Japan; Japan; Minamiise, Mie, Japan; Owase, Mie, Japan; Various Oceans (Distant Water Longline)",,
CHUBU SUISAN CO LTD,ID_34,Japan,Wholesale/Distribution,FALSE,TRUE,FALSE,TRUE,TRUE,FALSE,TRUE,"Chubu Suisan is a Japanese wholesale distributor specializing in fresh, frozen, and processed marine products, as well as prepared side dishes.",,Planet Tracker found species disclosure for part of the seafood portfolio of this company,238.7997003,12.07000694,0.954459283,2.55550931,1,1,1,1,1,2,,0,23,"Abalone, Bigeye Tuna, Blue Fish, Bluefin Tuna, Bonito, Crab, Eel Kabayaki, Flounder, Herring Roe, Mackerel, Marlin, Oysters, Pacific Saury, Salmon, Sardines, Scallops, Shellfish, Shrimp, Squid, Trout, Tuna, Yellowfin Tuna, Yellowtail",,-15.417633476480447,-15.796556139113168
CJ SEAFOOD,ID_35,Republic of Korea,Processing,FALSE,TRUE,FALSE,TRUE,TRUE,FALSE,FALSE,"CJ Seafood is a South Korean processor of prepared meat and seafood products, including fish cakes, ham, sausages, dried seaweed, and various pickled and preserved seafood items. Founded in 1976 and headquartered in Seongnam, South Korea.",https://www.cjseafood.net,Planet Tracker found species disclosure for part of the seafood portfolio of this company,142.0864915,40.94600235,2.249597206,6.208925428,1,1,2,1,1,1,0.1954963767771669,1,6,"Clam, Mackerel, Salmon, Scomber, Shrimp, Squid",South Korea,102.10208802200421,2.9266318235475004
CLEAN SEAS SEAFOOD LIMITED,ID_36,Australia,Aquaculture,FALSE,FALSE,TRUE,TRUE,TRUE,FALSE,FALSE,"Clean Seas manages the entire process of breeding, producing, and selling Yellowtail Kingfish.",,Planet Tracker found full species disclosure for the entire seafood portfolio of this company,45.08446295,23.61667736,-25.83972224,-44.13492258,3,3,3,0,2,0,0.7957439914947521,8,3,"Seriola Lalandi, Thunnus Maccoyii, Yellowtail Kingfish","Adelaide, South Australia, Australia; Arno Bay, South Australia, Australia; Asia; Australia; Europe; Fitzgerald Bay, Spencer Gulf, South Australia, Australia; North America; Port Lincoln, South Australia, Australia",31.56178958,-0.7482420080180157
CLEARWATER SEAFOODS INC,ID_37,Canada,Integrated,FALSE,TRUE,FALSE,TRUE,TRUE,FALSE,FALSE,"Clearwater Seafood Inc. is a company involved in the complete cycle of seafood management, including harvesting, processing, marketing, and distribution.",http://www.clearwater.ca,Planet Tracker found species disclosure for part of the seafood portfolio of this company,,,,,2,2,3,1,1,2,0.512966806376397,2,18,"Canadian Lobster, Capelin, Chionoecetes, Clam, Groundfish, Langoustine, Lobster, Nephropidae, Norway Lobster, Pectinidae, Rock Crab, Scallop, Shellfish, Shrimp, Snow Crab, Whelk",Argentina; Canada,,
CMC SEAFOOD,ID_38,Viet Nam,Processing,FALSE,FALSE,FALSE,FALSE,TRUE,FALSE,FALSE,"CMC Seafood is a US-based seafood wholesaler distributing various shrimp species (including black tiger, white, pink, and cat tiger shrimp) primarily sourced from farms in Vietnam.",https://cmcseafood.com,Planet Tracker found full species disclosure for the entire seafood portfolio of this company,,,,,1,1,1,0,1,0,0.916013373264823,3,6,"Black Tiger Shrimp, Cat Tiger Shrimp, Penaeus Monodon, Pink Shrimp, White Shrimp","Ca Mau, Vietnam; California, Usa; Vietnam",,
CNFC OVERSEAS FISHERIES CO LTD,ID_39,China,Fishing,FALSE,TRUE,FALSE,TRUE,FALSE,TRUE,FALSE,"CNFC Overseas Fisheries Co., Ltd. is a Chinese enterprise focused on the integrated deep-sea fisheries supply chain, including fishing, processing, storage, transport, and the international trade of ocean aquatic products.",https://cofc.cnadc.com.cn,Planet Tracker found species disclosure for part of the seafood portfolio of this company,683.5830773,,-5.409221419,-25.43430868,1,1,1,1,1,1,0.4638115996824573,3,10,"Albacore Tuna, Atlantic Bluefin Tuna, Bigeye Tuna, Scombridae, Shellfish, Squid, Tuna, Yellowfin Tuna","China; North Pacific Ocean, South Atlantic Ocean, Indian Ocean, Southwest Pacific Ocean; South Atlantic Ocean (Argentinean Squid), Pacific Ocean (Peruvian Squid)",921.7082845909,-196.38728402975562
AKVA GROUP ASA,ID_4,Norway,Fishing and Aquaculture Gear and Equipment,FALSE,FALSE,FALSE,FALSE,FALSE,FALSE,FALSE,"Akva Group ASA is a Norway-based global supplier of aquaculture technology, specializing in the design and manufacturing of equipment such as steel and plastic cages, work boats, feed systems, barges, sensor systems, and fish farming software.",http://www.akvagroup.com,Planet Tracker found full species disclosure for the entire seafood portfolio of this company,327.0732641,215.2666599,4.912718881,10.64029949,2,3,3,0,0,0,0.059784701437742414,1,19,"Dicentrarchus Labrax, Gadus Morhua, Lates Calcarifer, Oncorhynchus Kisutch, Oncorhynchus Mykiss, Oncorhynchus Tshawytscha, Oreochromis Niloticus, Penaeus Monodon, Rachycentron Canadum, Salmo Salar, Salmon, Salvelinus Alpinus, Solea Solea, Sparus Aurata, Thunnus Thynnus, Trout",Global,345.357338111443,3.693945071843677
COAST SEAFOOD AS,ID_40,Norway,Integrated,FALSE,FALSE,TRUE,TRUE,TRUE,FALSE,FALSE,"Coast Seafood AS is a Norwegian company specializing in the processing and global distribution of fresh and frozen fish, including organic salmon, trout, halibut, cod, pelagic fish, and white fish.",http://www.coast.no,Planet Tracker found species disclosure for part of the seafood portfolio of this company,,,,,1,1,2,1,1,2,0.8286671924174385,7,19,"Atlantic Salmon, Clupea Harengus, Cod, Fjord Trout, Gadus Morhua, Haddock, Herring, Mackerel, Melanogrammus Aeglefinus, Oncorhynchus Mykiss, Paralithodes Camtschaticus, Pollachius Virens, Salmo Salar, Scomber Scombrus, Shellfish, Trout, Whitefish","Germany (Handewitt); Norway (Kjøllefjord); Norway (Måløy); Norway (Norwegian Coastline); Norway (Norwegian Coastline, Including Organic From Senja); Norway (Sotra Fiskeindustri); Norway (Årvikbruket, Kjøllefjord)",,-1.775748945527957
COMPANIA PESQUERA CAMANCHACA SA,ID_41,Chile,Integrated,FALSE,TRUE,TRUE,TRUE,TRUE,FALSE,FALSE,"Camanchaca is a Chilean company with integrated operations spanning aquaculture, wild catch fishing, processing, and global distribution of seafood products.",http://www.camanchaca.cl,Planet Tracker found species disclosure for part of the seafood portfolio of this company,813.2600858,53.55272647,7.807598338,6.096967658,2,2,2,2,2,3,0.8381238571953431,3,10,"Atlantic Salmon, Chilean Salmon, Coho Salmon, Finfish, Mytilus Chilensis, Oncorhynchus Kisutch, Pleuroncodes Monodon, Salmo Salar, Shellfish, Trachurus Murphyi",Chile; Chile (Chiloé); Chile (Los Lagos And Aysén Regions),453.1217246195199,2.292038462769652
COOKE,ID_42,Canada,Aquaculture,FALSE,TRUE,TRUE,TRUE,TRUE,TRUE,TRUE,"Cooke is a family-owned Canadian seafood company based in Blacks Harbour, engaged in aquaculture, wild-catch fishing, and processing. Its product portfolio features salmon, trout, sea bass, and mussels.",https://www.cookeseafood.com,Planet Tracker found species disclosure for part of the seafood portfolio of this company,,,,,1,2,2,1,1,2,0.778463093598534,21,40,"Abalone, Alaska Crab, Alaska Halibut, Alaska Pollock, Argyrosomus Regius, Atlantic Salmon, Black Cod/Sablefish, Brevoortia Tyrannus, Chilean Atlantic Salmon, Coho H&G, Cold Ocean Salmon, Crayfish, Deep-Sea Red Crab, Dicentrarchus Labrax, Haddock, Kelly Cove Salmon, Lates Calcarifer, Mussel, Oyesters, Pacific Cod, Patagonia Silver Hake, Penaeus Monodon, Prawn, Roe Herring, Salmo Salar, Salmon, Scallops, Sea Bass, Seahorses, Seaweed, Shrimp, Southern King Crab, Sparus Aurata, Squid, Trout, Wild Alaska Salmon","Americas; Argentina; Australia (Queensland); Australia (Tasmania); Australia (Western Australia); Belgium; Canada; Canada (Atlantic Provinces); Chile; France; Honduras; Nicaragua; Scotland; Scotland (Orkney, Shetland, Mainland); Spain; United Kingdom; Uruguay; Us; Usa (Atlantic And Gulf Coasts); Usa (Maine); Usa (Washington)",,
CORPESCA,ID_43,Chile,Fishing,FALSE,TRUE,FALSE,TRUE,TRUE,FALSE,FALSE,"Corpesca is Chile's largest fishing company, engaged internationally in the production and distribution of fishmeal, fish oil, and other protein products.",,Planet Tracker found species disclosure for part of the seafood portfolio of this company,124.8551158,,-0.275654272,-4.738560873,1,2,1,2,1,3,0.5905728151549138,2,8,"Anchoveta, Anchovy, Engraulis Ringens, Mackerel, Sardinops Sagax, Scomber Japonicus, Spanish Sardine, Trachurus Murphyi","Chile (Arica Y Parinacota, Tarapacá, Antofagasta Regions); Chile, China, Vietnam, Japan, Germany, Italy, Spain, Canada, Denmark",,
CORPORACION EMPRESARIAL JEALSA SL,ID_44,Spain,Processing,FALSE,TRUE,FALSE,TRUE,FALSE,FALSE,FALSE,"Jealsa is a Spanish company that manufactures and distributes fish and canned seafood, with additional operations in aquaculture and fishing.",http://www.jealsa.com,Planet Tracker found species disclosure for part of the seafood portfolio of this company,,,,2.349,1,2,3,2,1,2,0.5820090921394613,6,12,"Albacore Tuna, Bigeye Tuna, Clam, Mussel, Salmon, Scallop, Shellfish, Skipjack Tuna, Squid, Tuna, Yellowfin Tuna",Brazil; Guatemala; Italy; Italy.1; Portugal; Spain,,
CP GROUP,ID_45,China,Aquaculture,TRUE,FALSE,TRUE,TRUE,TRUE,TRUE,TRUE,"CP Group is a diversified, foreign-funded conglomerate operating in mainland China for over four decades, with extensive investments across numerous sectors including feed, food, beverages, agriculture, retail (Charoen Pokphand Lotus, CP Plaza, CP Le City, CP Center), real estate, pharmaceuticals, electrical, and e-commerce.",http://www.cpgroup.cn,Planet Tracker found species disclosure for part of the seafood portfolio of this company,,,,,2,3,3,0,2,2,0.6704855594395751,8,12,"Chanos Chanos, Crab, Crabs, Oreochromis, Pangasius, Penaeus Monodon, Prawn, Scortum Barcoo, Shrimp, Yellow Croaker","China; India; Malaysia; Philippines; Thailand; Thailand, Vietnam, India, Cambodia, Philippines, Malaysia, Laos; United States; Vietnam",,
CP PRIMA,ID_46,Indonesia,Integrated,TRUE,FALSE,TRUE,TRUE,FALSE,TRUE,FALSE,"CP Prima is a vertically integrated Indonesian aquaculture firm, specializing in the production and sale of feed, fry, pet food, probiotics, shrimp, and processed food products.",https://www.cpp.co.id/,Planet Tracker found species disclosure for part of the seafood portfolio of this company,585.6934827,,8.764265186,9.107426634,2,1,2,0,1,1,0.053722833665025525,2,7,"Catfish, Cichlidae, Shrimp, Squid, Tilapia",India; Indonesia,,1.6325095621671408
CUULONG FISH,ID_47,Viet Nam,Aquaculture,FALSE,FALSE,TRUE,TRUE,TRUE,TRUE,TRUE,"Cuulong Fish is a leading Vietnamese company specializing in the farming and processing of Pangasius, with over 25 years in the industry.",https://clfish.com,Planet Tracker found full species disclosure for the entire seafood portfolio of this company,72.36678353,,1.602833344,1.478741764,2,2,2,0,2,2,0.9045340236829127,2,5,"Pangasiidae, Pangasius Bocourti, Pangasius Hypophthalmus","An Giang Province, Vietnam; Dong Thap Province, Vietnam",52.45384941825547,11.132668121456419
DAHU AQUACULTURE COMPANY LIMITED,ID_48,China,Aquaculture,FALSE,FALSE,TRUE,TRUE,TRUE,TRUE,FALSE,"Dahu Aquaculture Company Limited (Great Lakes Aquaculture Company Limited), established in 1999, is a freshwater fishery enterprise with an integrated, transparent supply chain from production to consumer. The company currently focuses on the health industry, supplying organic aquatic products and liquor, and offering health-related services through rehabilitation nursing hospitals.",,Planet Tracker found species disclosure for part of the seafood portfolio of this company,141.9645024,,3.746723475,-9.199097531,1,0,1,0,1,0,0.6755649487651058,1,11,"Bighead Carp, Bighead Silver Carp, Bream, Carp, Clupeidae, Crucian Carp, Cyprinidae, Hairy Crabs, Mandarin Fish",China,408.4398738101481,4.065158302623805
